{
  "$schema": "../../../schemas/task_contract.schema.json",
  "schema_version": "0.3.0",
  "task_id": "golden-doc-bundle-01",
  "claims": [
    {
      "claim_id": "relative-link-resolves",
      "statement": "The README's relative Details link resolves within the audited artifact set."
    },
    {
      "claim_id": "artifact-count-accurate",
      "statement": "Every factual statement in details.md accurately describes the audited artifact set."
    }
  ],
  "artifact_paths": [
    "golden_cases/self_contained/doc-bundle-01/artifacts/README.md",
    "golden_cases/self_contained/doc-bundle-01/artifacts/details.md"
  ],
  "packs": [
    "docs"
  ],
  "policy_overrides": [
    {
      "error_class": "material_requirement_miss",
      "gate_effect": "fail",
      "reason": "A broken link directly refutes the bounded documentation claim."
    }
  ]
}
