{
  "$schema": "../task_contract.schema.json",
  "schema_version": "0.3.0",
  "task_id": "docs-link-integrity",
  "claims": [
    {
      "claim_id": "relative-links-resolve",
      "statement": "All relative Markdown links in the audited artifact set resolve from the file that contains them."
    }
  ],
  "artifact_paths": [
    "protocol/COEVOLUTION.md"
  ],
  "packs": [
    "docs"
  ],
  "policy_overrides": [
    {
      "error_class": "broken-reference",
      "gate_effect": "fail",
      "reason": "A broken reference makes the audited documentation incomplete."
    }
  ]
}
